{
  "fontId": "measured.dejavu-sans-bold",
  "fontFamily": "DejaVu Sans Bold, Liberation Sans Bold, Arial Bold, sans-serif",
  "capHeightRatio": 0.729,
  "defaultAdvanceRatio": 1.3257,
  "maxHeightRatio": 0.42,
  "paddingRatio": 0.14,
  "lineGapRatio": 0.25,
  "advanceRatios": {
    " ": 0.3481,
    "(": 0.457,
    ")": 0.457,
    ",": 0.3799,
    "-": 0.415,
    ".": 0.3799,
    "/": 0.3652,
    "0": 0.6958,
    "1": 0.6958,
    "2": 0.6958,
    "3": 0.6958,
    "4": 0.6958,
    "5": 0.6958,
    "6": 0.6958,
    "7": 0.6958,
    "8": 0.6958,
    "9": 0.6958,
    ":": 0.3999,
    ";": 0.3999,
    "A": 0.7739,
    "B": 0.7622,
    "C": 0.7339,
    "D": 0.8301,
    "E": 0.6831,
    "F": 0.6831,
    "G": 0.8208,
    "H": 0.8369,
    "I": 0.3721,
    "J": 0.3721,
    "K": 0.7749,
    "L": 0.6372,
    "M": 0.9951,
    "N": 0.8369,
    "O": 0.8501,
    "P": 0.7329,
    "Q": 0.8501,
    "R": 0.77,
    "S": 0.7202,
    "T": 0.6821,
    "U": 0.812,
    "V": 0.7739,
    "W": 1.103,
    "X": 0.771,
    "Y": 0.7241,
    "Z": 0.7251,
    "Ё": 0.6831,
    "А": 0.7739,
    "Б": 0.7622,
    "В": 0.7622,
    "Г": 0.6372,
    "Д": 0.8906,
    "Е": 0.6831,
    "Ж": 1.2241,
    "З": 0.7104,
    "И": 0.8369,
    "Й": 0.8369,
    "К": 0.8174,
    "Л": 0.8306,
    "М": 0.9951,
    "Н": 0.8369,
    "О": 0.8501,
    "П": 0.8369,
    "Р": 0.7329,
    "С": 0.7339,
    "Т": 0.6821,
    "У": 0.771,
    "Ф": 0.9917,
    "Х": 0.771,
    "Ц": 0.9277,
    "Ч": 0.8081,
    "Ш": 1.2354,
    "Щ": 1.3257,
    "Ъ": 0.9395,
    "Ы": 1.0361,
    "Ь": 0.7622,
    "Э": 0.7339,
    "Ю": 1.1738,
    "Я": 0.77,
    "а": 0.6748,
    "б": 0.6982,
    "в": 0.6328,
    "г": 0.5225,
    "д": 0.8076,
    "е": 0.6782,
    "ж": 0.9951,
    "з": 0.5811,
    "и": 0.7007,
    "й": 0.7007,
    "к": 0.6787,
    "л": 0.7324,
    "м": 0.8174,
    "н": 0.6909,
    "о": 0.687,
    "п": 0.6909,
    "р": 0.7158,
    "с": 0.5928,
    "т": 0.5796,
    "у": 0.6519,
    "ф": 0.9922,
    "х": 0.645,
    "ц": 0.7412,
    "ч": 0.6865,
    "ш": 1.062,
    "щ": 1.1055,
    "ъ": 0.7515,
    "ы": 0.9043,
    "ь": 0.6323,
    "э": 0.5928,
    "ю": 0.9722,
    "я": 0.6421,
    "ё": 0.6782,
    "–": 0.5,
    "—": 1.0,
    "№": 1.2031
  },
  "measuredFrom": {
    "file": "DejaVuSans-Bold.ttf",
    "sha256": "b184b89e3c1075f22f6b71575b6fc20d4972b3cfd3b23322ca6fd596dcaef167",
    "unitsPerEm": 2048,
    "glyphs": 114,
    "tool": "scripts/measure_font.py (fontTools, чтение hmtx и контура буквы H)",
    "note": "Метрики сняты с реального файла шрифта, а не выдуманы. DejaVu Sans Bold шире Arial Bold, поэтому запас идёт в безопасную сторону: надпись, вписавшаяся по этой модели, не вылезет и в Arial."
  },
  "normRef": {
    "doc": "ГОСТ Р 52290-2024",
    "clause": "п. 3.4; прил. В, Г; масштабная сетка прил. Б"
  },
  "verification": "Unverified",
  "note": "Модель метрик измерена по конкретному файлу шрифта и потому не врёт о ширине строки. НЕ подтверждено нормой: какая гарнитура и какая высота надписей требуются по ГОСТ (GOST-002) — это снимает с масштабной сетки прил. Б студент. maxHeightRatio и paddingRatio остаются условными.",
  "markers": [
    "GOST-002"
  ]
}
